element,type,author
"Ich überbringe Ihre Wertsachen schnell und zuverlässig",headline,Jens
"Brauchen Sie einen schnellen und zuverlässigen Boten?",headline,Jens
"Ich überbringe Ihre Wertsachen sicher, schnell und zuverlässig",headline,Jens
"Ich überbringe Ihre Wertgegenstände sicher, schnell und zuverlässig",headline,Jens
"Ich überbringe Ihre Wertgegenstände sicher, schnell und zuverlässig",headline,Jens
"Ich bringe Ihre Wertgegenstände sicher, schnell und zuverlässig von A nach B",headline,Jens
"Ich bringe Ihre Wertgegenstände persönlich, schnell und zuverlässig von A nach B",headline,Jens
"Ihre Wertgegenstände – in sicheren Händen schnell von A nach B",headline,Jens
"Sie möchten einen Wertgegenstand von A nach B bringen lassen? Ich transportiere ihn schnell, sicher sowie zuverlässig – und behüte ihn so, als wäre es mein eigener",uvp,Jens
"Wertgegenstände sicher von A nach B bringen? Ich erledige das schnell und zuverlässig für Sie – und behüte Ihr Eigentum wie meinen eigenen Besitz",uvp,Gemini
